{"$id":"urn:acme-firm:schema:oracle-catalog:1.0.0","$schema":"https://json-schema.org/draft/2020-12/schema","additionalProperties":false,"description":"Índice cerrado de dieciséis oráculos; no embebe valores esperados.","properties":{"$schema":{"const":"../schemas/oracle_catalog.schema.json","type":"string"},"catalog_id":{"const":"ORACLES-16","type":"string"},"entries":{"items":{"additionalProperties":false,"properties":{"oracle_id":{"pattern":"^S(?:0[0-9]|1[0-5])\\.expected$","type":"string"},"oracle_path":{"pattern":"^oracles/S(?:0[0-9]|1[0-5])\\.expected\\.json$","type":"string"},"scenario_id":{"pattern":"^S(?:0[0-9]|1[0-5])$","type":"string"},"sha256":{"oneOf":[{"type":"null"},{"pattern":"^[0-9a-f]{64}$","type":"string"}]}},"required":["oracle_id","scenario_id","oracle_path","sha256"],"type":"object"},"maxItems":16,"minItems":16,"type":"array","uniqueItems":true,"x-ifm6-unique-by":["oracle_id","scenario_id","oracle_path"]},"expected_entry_count":{"const":16,"type":"integer"},"hash_policy":{"additionalProperties":false,"properties":{"algorithm":{"const":"SHA-256","type":"string"},"encoding":{"const":"64 lowercase hexadecimal characters","type":"string"},"post_freeze_rule":{"const":"every sha256 is mandatory and non-null after its separate oracle file is frozen","type":"string"},"pre_materialization_seed_value":{"type":"null"},"scope":{"const":"complete canonical oracle file bytes including exactly one terminal LF","type":"string"}},"required":["algorithm","encoding","post_freeze_rule","pre_materialization_seed_value","scope"],"type":"object"},"index_only":{"const":true,"type":"boolean"},"schema_version":{"const":"1.0.0","type":"string"},"source_of_truth":{"minLength":1,"type":"string"}},"required":["$schema","schema_version","catalog_id","expected_entry_count","index_only","source_of_truth","hash_policy","entries"],"title":"IFATIGUE-INFRA6-M6 oracle catalog contract","type":"object"}
