{"$schema":"../schemas/oracle_catalog.schema.json","catalog_id":"ORACLES-16","entries":[{"oracle_id":"S00.expected","oracle_path":"oracles/S00.expected.json","scenario_id":"S00","sha256":"6bfa69a9b9256f3f1d11948a3ccdd103698866bcde0de01a87e987dc9862eaa1"},{"oracle_id":"S01.expected","oracle_path":"oracles/S01.expected.json","scenario_id":"S01","sha256":"f593a0b4ad473e6574b54ef19a9a347819eb3beceecca2c6b9edfe2e5de403ae"},{"oracle_id":"S02.expected","oracle_path":"oracles/S02.expected.json","scenario_id":"S02","sha256":"c8e9e05f277bdc498f53a913f1a85a72f934e70b38ad6001aea18601d25d08bb"},{"oracle_id":"S03.expected","oracle_path":"oracles/S03.expected.json","scenario_id":"S03","sha256":"a1a1b31f74a0bf7e915ce7225b8b889352f3a5b5a9487d2f5ba4801b2c22cf6d"},{"oracle_id":"S04.expected","oracle_path":"oracles/S04.expected.json","scenario_id":"S04","sha256":"6baea9819210d33917791da624d08bfb6d949093574cc544aab46088dc616da5"},{"oracle_id":"S05.expected","oracle_path":"oracles/S05.expected.json","scenario_id":"S05","sha256":"24f7bcaee6b6f02d3eff86b433823c6cb44fc49a17259d7379eb846e10b7d293"},{"oracle_id":"S06.expected","oracle_path":"oracles/S06.expected.json","scenario_id":"S06","sha256":"eacc5e0de2d7fe7e885ed50201d11f0e935de9e7d40c857423db802750d69bdb"},{"oracle_id":"S07.expected","oracle_path":"oracles/S07.expected.json","scenario_id":"S07","sha256":"4734c9e7871eac3ca61ab886b7c0d447aaefc6f3a0a81f659f741e573ed54d99"},{"oracle_id":"S08.expected","oracle_path":"oracles/S08.expected.json","scenario_id":"S08","sha256":"cd279dd5cbc51ec485e4db6479729f47882ac4b4996075815119c14c91324283"},{"oracle_id":"S09.expected","oracle_path":"oracles/S09.expected.json","scenario_id":"S09","sha256":"29ca4bf805176bab7f97e63f23901caf3dacfc6d3bf2a3984e1423172e403b0f"},{"oracle_id":"S10.expected","oracle_path":"oracles/S10.expected.json","scenario_id":"S10","sha256":"d0ec9f96768358e7d968eab728d167915083ea43158e4b2648030e18f314a46c"},{"oracle_id":"S11.expected","oracle_path":"oracles/S11.expected.json","scenario_id":"S11","sha256":"33daac898ffbc4a95c26b2b7b83f19be44e3a6b3ebb014cdde543c37e69bcffd"},{"oracle_id":"S12.expected","oracle_path":"oracles/S12.expected.json","scenario_id":"S12","sha256":"4ceb1cead9d798b44a1a360d39613e92ae40e46e2f4d89d977665d383415083f"},{"oracle_id":"S13.expected","oracle_path":"oracles/S13.expected.json","scenario_id":"S13","sha256":"e7f7dd1c214b3699390fdbfcd40db3f38ba478ad06f3ce6d37396b250b6dafbe"},{"oracle_id":"S14.expected","oracle_path":"oracles/S14.expected.json","scenario_id":"S14","sha256":"e054178b71d09becd2f36821d01e3c502de2f0f6fef8c36db56a227cf3d311d1"},{"oracle_id":"S15.expected","oracle_path":"oracles/S15.expected.json","scenario_id":"S15","sha256":"3653c5ae32977d96de7bf65fa9f8ef6a35aaeb0f970ae69c63100aa44f2fc8bd"}],"expected_entry_count":16,"hash_policy":{"algorithm":"SHA-256","encoding":"64 lowercase hexadecimal characters","post_freeze_rule":"every sha256 is mandatory and non-null after its separate oracle file is frozen","pre_materialization_seed_value":null,"scope":"complete canonical oracle file bytes including exactly one terminal LF"},"index_only":true,"schema_version":"1.0.0","source_of_truth":"separate frozen oracle files oracles/S00.expected.json through oracles/S15.expected.json"}
